{
  "image_id": "img_0001",
  "image_size": { "width": 1920, "height": 1080 },
  "preprocess": {
    "correction_strength": 0.35,
    "steps": [
      { "name": "clahe", "strength": 0.4 },
      { "name": "perspective", "strength": 0.3 }
    ]
  },
  "texts": [
    {
      "id": "t1", "text": "P-1", "prob": 0.97, "bbox": [412, 288, 598, 362],
      "style": "stamped", "source": "paddleocr", "char_probs": [0.98, 0.97, 0.96]
    },
    {
      "id": "t2", "text": "FW", "prob": 0.62, "bbox": [640, 300, 742, 360],
      "style": "handwritten", "source": "trocr", "char_probs": [0.64, 0.97],
      "candidates": [{ "text": "FW", "prob": 0.62 }, { "text": "EW", "prob": 0.24 }]
    },
    {
      "id": "t3", "text": "t=10", "prob": 0.91, "bbox": [420, 390, 560, 440],
      "style": "stencil", "source": "paddleocr", "char_probs": [0.9, 0.93, 0.95, 0.92]
    }
  ],
  "symbols": [
    { "id": "s1", "label": "▲", "prob": 0.88, "bbox": [780, 295, 840, 355], "source": "yolox" }
  ],
  "models": { "ocr": "paddleocr-3.7.0", "handwriting": "trocr-base-handwritten", "detector": "yolox-s" },
  "elapsed_ms": 840
}
